{
  "$schema": "http://json-schema.org/draft-06/schema#",
  "id": "http://hl7.org/fhir/json-schema/Organization",
  "description": "A formally or informally recognized grouping of people or organizations formed for the purpose of achieving some form of collective action. Includes companies, institutions, corporations, departments, community groups, healthcare practice groups, payer/insurer, etc.",
  "type": "object",
  "required": ["resourceType"],
  "properties": {
    "resourceType": { "const": "Organization" },
    "id": { "type": "string", "description": "Logical id of this artifact" },
    "_id": { "type": "string", "description": "MongoDB primary key" },
    "meta": { "type": "object", "properties": { "versionId": { "type": "string" }, "lastUpdated": { "type": "string" }, "source": { "type": "string" }, "profile": { "type": "array", "items": { "type": "string" } }, "security": { "type": "array", "items": { "type": "object", "properties": { "system": { "type": "string" }, "code": { "type": "string" }, "display": { "type": "string" } } } }, "tag": { "type": "array", "items": { "type": "object", "properties": { "system": { "type": "string" }, "code": { "type": "string" }, "display": { "type": "string" } } } } } },
    "implicitRules": { "type": "string" },
    "language": { "type": "string" },
    "text": { "type": "object", "properties": { "status": { "type": "string" }, "div": { "type": "string" } } },
    "contained": { "type": "array", "items": { "type": "object" } },
    "extension": { "type": "array", "items": { "type": "object" } },
    "modifierExtension": { "type": "array", "items": { "type": "object" } },
    "identifier": { "type": "array", "items": { "type": "object", "properties": { "use": { "type": "string" }, "type": { "type": "object", "properties": { "coding": { "type": "array", "items": { "type": "object", "properties": { "system": { "type": "string" }, "code": { "type": "string" }, "display": { "type": "string" } } } }, "text": { "type": "string" } } }, "system": { "type": "string" }, "value": { "type": "string" }, "period": { "type": "object", "properties": { "start": { "type": "string" }, "end": { "type": "string" } } }, "assigner": { "type": "object", "properties": { "reference": { "type": "string" }, "display": { "type": "string" } } } } } },
    "active": { "type": "boolean" },
    "type": { "type": "array", "items": { "type": "object", "properties": { "coding": { "type": "array", "items": { "type": "object", "properties": { "system": { "type": "string" }, "code": { "type": "string" }, "display": { "type": "string" } } } }, "text": { "type": "string" } } } },
    "name": { "type": "string" },
    "alias": { "type": "array", "items": { "type": "string" } },
    "telecom": { "type": "array", "items": { "type": "object", "properties": { "system": { "type": "string" }, "value": { "type": "string" }, "use": { "type": "string" }, "rank": { "type": "integer" }, "period": { "type": "object", "properties": { "start": { "type": "string" }, "end": { "type": "string" } } } } } },
    "address": { "type": "array", "items": { "type": "object", "properties": { "use": { "type": "string" }, "type": { "type": "string" }, "text": { "type": "string" }, "line": { "type": "array", "items": { "type": "string" } }, "city": { "type": "string" }, "district": { "type": "string" }, "state": { "type": "string" }, "postalCode": { "type": "string" }, "country": { "type": "string" }, "period": { "type": "object", "properties": { "start": { "type": "string" }, "end": { "type": "string" } } } } } },
    "partOf": { "type": "object", "properties": { "reference": { "type": "string" }, "display": { "type": "string" } } },
    "contact": { "type": "array", "items": { "type": "object", "properties": { "purpose": { "type": "object", "properties": { "coding": { "type": "array", "items": { "type": "object", "properties": { "system": { "type": "string" }, "code": { "type": "string" }, "display": { "type": "string" } } } }, "text": { "type": "string" } } }, "name": { "type": "object", "properties": { "use": { "type": "string" }, "text": { "type": "string" }, "family": { "type": "string" }, "given": { "type": "array", "items": { "type": "string" } }, "prefix": { "type": "array", "items": { "type": "string" } }, "suffix": { "type": "array", "items": { "type": "string" } } } }, "telecom": { "type": "array", "items": { "type": "object", "properties": { "system": { "type": "string" }, "value": { "type": "string" }, "use": { "type": "string" } } } }, "address": { "type": "object", "properties": { "use": { "type": "string" }, "type": { "type": "string" }, "text": { "type": "string" }, "line": { "type": "array", "items": { "type": "string" } }, "city": { "type": "string" }, "district": { "type": "string" }, "state": { "type": "string" }, "postalCode": { "type": "string" }, "country": { "type": "string" } } } } } },
    "endpoint": { "type": "array", "items": { "type": "object", "properties": { "reference": { "type": "string" }, "display": { "type": "string" } } } }
  }
}
